{
  "versaoSchema": "1.0.0",
  "metadados": {
    "geradoEm": "2026-04-26T23:16:42.406Z",
    "perfilExecucao": "rapido",
    "duracaoTotalMs": 126678,
    "maquina": "Leonardos-Mac-mini.local",
    "sistemaOperacional": "darwin 25.4.0",
    "git": {
      "branch": "main",
      "commit": "9dfc377bce4589a1fe497559ff9a08fe2ba3c386",
      "commitCurto": "9dfc377bc",
      "worktreeSujo": false
    }
  },
  "resumo": {
    "statusGeral": "vermelho",
    "indiceSaude": 20,
    "totais": {
      "verificacoes": 5,
      "sucesso": 1,
      "falha": 4,
      "alerta": 0,
      "naoExecutado": 0
    }
  },
  "verificacoes": [
    {
      "codigo": "backend-unitario",
      "nome": "Backend unitario",
      "categoria": "teste",
      "status": "falha",
      "duracaoMs": 29475,
      "comando": "gradlew.bat :backend:unitTest",
      "diretorio": "backend",
      "sumario": "1208/1213 testes aprovados no backend unitario.",
      "metricas": {
        "testes": 1213,
        "falhas": 5,
        "ignorados": 0,
        "tempoSegundos": 20.418,
        "sucessos": 1208,
        "arquivosXml": [
          "backend/build/test-results/unitTest/TEST-sg-5S37E63PMOUSQ.service.SubprocessoConsultaServiceExtraCoverageTest$ListarPorProcessoEUnidadeCodigosESituacoes.xml",
          "backend/build/test-results/unitTest/TEST-sg-R666T4H326GOM.subprocesso.service.SubprocessoConsultaServiceExtraCoverageTest$ListarAtividadesParaImportacao.xml",
          "backend/build/test-results/unitTest/TEST-sgc.-DQ2U8KEC5JS04.service.SubprocessoValidacaoServiceCoverageTest$ValidarRequisitosNegocioParaDisponibilizacao.xml",
          "backend/build/test-results/unitTest/TEST-sgc.alerta.AlertaControllerTest$ListarAlertas.xml",
          "backend/build/test-results/unitTest/TEST-sgc.alerta.AlertaControllerTest$MarcarComoLidos.xml",
          "backend/build/test-results/unitTest/TEST-sgc.alerta.AlertaFacadeCoverageTest.xml",
          "backend/build/test-results/unitTest/TEST-sgc.alerta.AlertaFacadeTest$ListagemAlertas.xml",
          "backend/build/test-results/unitTest/TEST-sgc.alerta.AlertaFacadeTest$MarcacaoLidos.xml",
          "backend/build/test-results/unitTest/TEST-sgc.alerta.AlertaFacadeTest$Paginacao.xml",
          "backend/build/test-results/unitTest/TEST-sgc.alerta.AlertaFacadeTest.xml",
          "backend/build/test-results/unitTest/TEST-sgc.alerta.AlertaServiceTest.xml",
          "backend/build/test-results/unitTest/TEST-sgc.alerta.EmailModelosServiceExtraCoverageTest.xml",
          "backend/build/test-results/unitTest/TEST-sgc.alerta.NotificacaoAdminControllerTest.xml",
          "backend/build/test-results/unitTest/TEST-sgc.alerta.NotificacaoControllerTest.xml",
          "backend/build/test-results/unitTest/TEST-sgc.alerta.NotificacaoServiceTest.xml",
          "backend/build/test-results/unitTest/TEST-sgc.alerta.NotificacaoWorkerTest.xml",
          "backend/build/test-results/unitTest/TEST-sgc.alerta.dto.AlertaDtoTest.xml",
          "backend/build/test-results/unitTest/TEST-sgc.alerta.model.AlertaTest.xml",
          "backend/build/test-results/unitTest/TEST-sgc.alerta.notificacao.EmailModelosServiceTest$Finalizacao.xml",
          "backend/build/test-results/unitTest/TEST-sgc.alerta.notificacao.EmailModelosServiceTest.xml",
          "backend/build/test-results/unitTest/TEST-sgc.alerta.notificacao.EmailServiceTest.xml",
          "backend/build/test-results/unitTest/TEST-sgc.arquitetura.ArchConsistencyTest.xml",
          "backend/build/test-results/unitTest/TEST-sgc.arquitetura.EqualsHashCodeTest.xml",
          "backend/build/test-results/unitTest/TEST-sgc.comum.config.ConfigOpenApiCoverageTest.xml",
          "backend/build/test-results/unitTest/TEST-sgc.comum.dto.ComumDtosValidationTest$DataRequestTests.xml",
          "backend/build/test-results/unitTest/TEST-sgc.comum.dto.ComumDtosValidationTest$JustificativaRequestTests.xml",
          "backend/build/test-results/unitTest/TEST-sgc.comum.dto.ComumDtosValidationTest$TextoRequestTests.xml",
          "backend/build/test-results/unitTest/TEST-sgc.comum.erros.CustomExceptionsTest.xml",
          "backend/build/test-results/unitTest/TEST-sgc.comum.erros.RestExceptionHandlerCoverageTest.xml",
          "backend/build/test-results/unitTest/TEST-sgc.comum.erros.RestExceptionHandlerSecurityTest.xml",
          "backend/build/test-results/unitTest/TEST-sgc.comum.erros.RestExceptionHandlerTest.xml",
          "backend/build/test-results/unitTest/TEST-sgc.comum.json.DeserializadorHtmlSanitizadoTest.xml",
          "backend/build/test-results/unitTest/TEST-sgc.comum.model.EntidadeBaseTest.xml",
          "backend/build/test-results/unitTest/TEST-sgc.comum.model.TituloEleitoralValidationTest.xml",
          "backend/build/test-results/unitTest/TEST-sgc.comum.util.FiltroMonitoramentoHttpTest.xml",
          "backend/build/test-results/unitTest/TEST-sgc.comum.util.FormatadorDataTest.xml",
          "backend/build/test-results/unitTest/TEST-sgc.comum.util.MonitoramentoAspectTest.xml",
          "backend/build/test-results/unitTest/TEST-sgc.e2e.E2eControllerCoverageTest.xml",
          "backend/build/test-results/unitTest/TEST-sgc.mapa.dto.AtividadeDtoTest.xml",
          "backend/build/test-results/unitTest/TEST-sgc.mapa.dto.AtividadeMapaDtoTest.xml",
          "backend/build/test-results/unitTest/TEST-sgc.mapa.dto.AtualizarMapaRequestTest.xml",
          "backend/build/test-results/unitTest/TEST-sgc.mapa.dto.CompetenciaMapaDtoTest.xml",
          "backend/build/test-results/unitTest/TEST-sgc.mapa.dto.ConhecimentoResumoDtoTest.xml",
          "backend/build/test-results/unitTest/TEST-sgc.mapa.dto.CriarMapaRequestTest.xml",
          "backend/build/test-results/unitTest/TEST-sgc.mapa.dto.ImpactoMapaResponseTest.xml",
          "backend/build/test-results/unitTest/TEST-sgc.mapa.dto.MapaCompletoDtoTest.xml",
          "backend/build/test-results/unitTest/TEST-sgc.mapa.dto.MapaResumoDtoTest.xml",
          "backend/build/test-results/unitTest/TEST-sgc.mapa.model.AtividadeJsonViewTest.xml",
          "backend/build/test-results/unitTest/TEST-sgc.mapa.model.AtividadeTest.xml",
          "backend/build/test-results/unitTest/TEST-sgc.mapa.model.CompetenciaTest.xml",
          "backend/build/test-results/unitTest/TEST-sgc.mapa.model.ConhecimentoJsonViewTest.xml",
          "backend/build/test-results/unitTest/TEST-sgc.mapa.model.ConhecimentoTest.xml",
          "backend/build/test-results/unitTest/TEST-sgc.mapa.service.AtividadeFacadeTest$AtualizarAtividadeTests.xml",
          "backend/build/test-results/unitTest/TEST-sgc.mapa.service.AtividadeFacadeTest$AtualizarConhecimentoTests.xml",
          "backend/build/test-results/unitTest/TEST-sgc.mapa.service.AtividadeFacadeTest$CriarAtividadeTests.xml",
          "backend/build/test-results/unitTest/TEST-sgc.mapa.service.AtividadeFacadeTest$CriarConhecimentoTests.xml",
          "backend/build/test-results/unitTest/TEST-sgc.mapa.service.AtividadeFacadeTest$ExcluirAtividadeTests.xml",
          "backend/build/test-results/unitTest/TEST-sgc.mapa.service.AtividadeFacadeTest$ExcluirConhecimentoTests.xml",
          "backend/build/test-results/unitTest/TEST-sgc.mapa.service.AtividadeFacadeTest$ListarConhecimentosPorAtividadeTests.xml",
          "backend/build/test-results/unitTest/TEST-sgc.mapa.service.AtividadeFacadeTest$ObterAtividadePorIdTests.xml",
          "backend/build/test-results/unitTest/TEST-sgc.mapa.service.AtividadeFacadeTest$VerificarPermissaoEdicaoTests.xml",
          "backend/build/test-results/unitTest/TEST-sgc.mapa.service.CopiaMapaServiceCoverageTest.xml",
          "backend/build/test-results/unitTest/TEST-sgc.mapa.service.CopiaMapaServiceTest.xml",
          "backend/build/test-results/unitTest/TEST-sgc.mapa.service.ImpactoMapaServiceCoverageTest$CheckSituacaoTest.xml",
          "backend/build/test-results/unitTest/TEST-sgc.mapa.service.ImpactoMapaServiceCoverageTest.xml",
          "backend/build/test-results/unitTest/TEST-sgc.mapa.service.ImpactoMapaServiceTest$Coverage.xml",
          "backend/build/test-results/unitTest/TEST-sgc.mapa.service.ImpactoMapaServiceTest.xml",
          "backend/build/test-results/unitTest/TEST-sgc.mapa.service.MapaManutencaoServiceCoverageExtraTest.xml",
          "backend/build/test-results/unitTest/TEST-sgc.mapa.service.MapaSalvamentoServiceTest.xml",
          "backend/build/test-results/unitTest/TEST-sgc.mapa.service.MapaVisualizacaoServiceCoverageTest.xml",
          "backend/build/test-results/unitTest/TEST-sgc.mapa.service.MapaVisualizacaoServiceTest.xml",
          "backend/build/test-results/unitTest/TEST-sgc.organizacao.CacheAdminControllerTest.xml",
          "backend/build/test-results/unitTest/TEST-sgc.organizacao.EventosControllerTest.xml",
          "backend/build/test-results/unitTest/TEST-sgc.organizacao.HierarquiaServiceTest.xml",
          "backend/build/test-results/unitTest/TEST-sgc.organizacao.ModelExtraTest.xml",
          "backend/build/test-results/unitTest/TEST-sgc.organizacao.UsuarioFacadeTest$AutenticacaoContexto.xml",
          "backend/build/test-results/unitTest/TEST-sgc.organizacao.UsuarioFacadeTest$BuscaUsuarios.xml",
          "backend/build/test-results/unitTest/TEST-sgc.organizacao.UsuarioFacadeTest$CarregamentoAutenticacao.xml",
          "backend/build/test-results/unitTest/TEST-sgc.organizacao.UsuarioFacadeTest$GestaoAdministradores.xml",
          "backend/build/test-results/unitTest/TEST-sgc.organizacao.UsuarioFacadeTest$ResponsabilidadesEPerfis.xml",
          "backend/build/test-results/unitTest/TEST-sgc.organizacao.ValidadorDadosOrganizacionaisExtraCoverageTest.xml",
          "backend/build/test-results/unitTest/TEST-sgc.organizacao.ValidadorDadosOrganizacionaisTest.xml",
          "backend/build/test-results/unitTest/TEST-sgc.organizacao.dto.DiagnosticoOrganizacionalDtoTest.xml",
          "backend/build/test-results/unitTest/TEST-sgc.organizacao.dto.PerfilDtoTest.xml",